iteration	commit	started_at	propose_sec	implement_sec	test_sec	evaluate_sec	total_sec	tests_passed	tests_total	ts_check	score	status	description
693	a57f663	2026-04-21	75	359	780	24	1238	2532	2534	pass	7.25	kept	Phrasal Verb Particle Drill (typing-based productive recall: 62 items × 3 levels; /drill + /attempt endpoints; Select→Drill→Summary with accepted-synonyms, localStorage weak-item prioritization, Retry missed only; 28 new tests; amended to restore iter 692 monologue wiring)
694	a3d80e7	2026-04-21	58	457	214	49	778	2563	2565	pass	7.25	kept	Tag Question Drill (produce tag + rising/falling intonation): /session (Copilot + ≥8-item fallback) + /attempt (normalized grade) + TagQuestionDrill page with chips/TTS Listen/results; 31 new tests; 2 pre-existing dashboard failures unrelated
695	ae5236b	2026-04-21	53	511	209	56	829	2574	2576	pass	7.55	kept	Tense Contrast Drill (past simple vs present perfect vs PPC): /session (Copilot + static fallback bank) + /submit + /stats, new tense_contrast_attempts table+migration, DAL, TenseContrast page with per-tense bars + retry-missed + Home CTA; 11 new tests; 2 pre-existing dashboard failures unrelated
696	d14bec5	2026-04-21	58	397	236	34	725	2587	2589	pass	7.35	kept	WH-Question Formation speaking drill (Jeopardy-style): /start (Copilot+seed fallback) + /grade endpoints, new wh_question_attempts table+migration, DAL, WhQuestionDrill page with TTS answer→mic→grade→per-wh summary+retry-missed + Home CTA; 13 new tests; 2 pre-existing dashboard failures unrelated
697	1b84f7b	2026-04-21	54	567	217	47	885	2611	2613	pass	7.80	kept	Error Correction typing drill (grammar repair): /start + /grade (Copilot+fallback) + /finish endpoints; 2 new tables (error_correction_sessions/items); word-level diff + JA explanation; ErrorCorrection page (category/level → textarea Enter-submit → red/green diff → summary) + Home CTA; 24 new tests; 2 pre-existing dashboard failures unrelated
698	5fbc1fe	2026-04-21T03:04:47+09:00	0	0	0	0	0	0	0	pass	7.0	keep	Minimal Pairs listening discrimination drill
699	76ba9f9	2026-04-21	60	849	224	34	1167	2646	2648	pass	7.25	discarded	Word Stress Placement drill (90-word bank × 3 levels + N/V confusables, /next /attempt /stats + new word_stress_attempts table, syllable-chip page, 20 new tests) — discarded by evaluator verdict despite pre-existing-only failures
700	8e51c46	2026-04-21	249	269	238	27	783	2645	2647	pass	7.75	kept	Connected Speech Decoder drill (reductions: gonna/wanna/whatcha/lemme/didja/kinda; TTS replay-limited listen→type expanded form; /session /attempt /stats + curated JSON bank + new connected_speech_attempts table+migration + Home CTA; 19 new tests; 2 pre-existing dashboard failures unrelated)
701	f4b74b1	2026-04-21	130	411	235	31	807	2659	2661	pass	7.25	kept	Preposition Cloze Drill (fill-in preposition with 4-6 chip options + one-line explanation + confused-pair top-3 ranking): /session /attempt /stats + 65-item JSON bank across time/place/collocation/phrasal + new preposition_attempts table+migration + PrepositionDrill page + retry-missed + Home CTA; 14 new tests; 2 pre-existing dashboard failures unrelated
702	707a156	2026-04-21	68	750	253	41	1112	2690	2692	pass	7.50	kept	Pause & Predict listening drill (predict final 1-3 word chunk from TTS-truncated sentence): /session (LLM+static fallback, strict-prefix validated) + /submit (exact=1.0/alt=0.9/close=0.6 scoring) + /session/complete + /recent + /stats; new pause_predict_sessions table+migration+indexes; PausePredictPage with replay≤3, keyboard shortcuts, reveal+summary; Home CTA; 31 new tests; 2 pre-existing dashboard failures unrelated
703	582190a	2026-04-21	54	838	231	45	1168	2708	2710	pass	7.00	kept	Article Chip Drill (a/an/the/∅ tap-to-fill): /session (LLM+static fallback) + /submit (per-blank + category breakdown) + /stats; new article_attempts table+migration; ArticleDrill page with chip input, keyboard 1-4, reveal green/red + rule hints, per-category bars, Retry-missed; Home CTA; 18 new tests; 2 pre-existing dashboard failures unrelated
704	69485e3	2026-04-21	139	386	251	36	812	2727	2729	pass	7.00	kept	Intonation Arrow Drill (rising vs falling vs rise-fall): /session (24-item curated bank) + /attempt + /stats; new intonation_arrow_attempts table+migration; IntonationArrowPage with Listen (≤2 replays) + 3 arrow chips + per-pattern summary + Retry-wrong-only; Home CTA; 20 new tests; 2 pre-existing dashboard failures unrelated
705	41e82ec	2026-04-21	180	387	706	26	1299	2744	2746	pass	7.00	kept	Collocation Chef (verb+noun delexical-verb drill: make/do/take/have/give+): /session (60+ curated items × easy/medium/hard) + /attempt + /stats; new collocation_attempts table+migration (with stale-table DROP cleanup); CollocationChef page with 4-chip picker + keyboard 1-4 + related collocations on reveal + per-verb bar chart + Retry-wrong-only; Home CTA; 17 new tests; 2 pre-existing dashboard failures unrelated
706	fa593f7	2026-04-21	73	410	268	50	801	2770	2772	pass	7.55	kept	Elastic Sentence drill (progressive expansion + speak): /generate (Copilot+static fallback, target+chain[] with each step adding 1-3 tokens) + /submit persisting session + /recent + /stats; new elastic_sentence_sessions table+migration; ElasticSentencePage with difficulty picker (short/medium/long), per-step TTS playback stepper, final speak+score with transcript diff, results card showing max_step_reached/chain_length + final_accuracy; Home CTA; 26 new tests; 2 pre-existing dashboard failures unrelated
707	f69c457	2026-04-21	42	549	257	41	889	2796	2798	pass	7.35	kept	Reported Speech Transformation drill (direct→indirect): /session (Copilot+static fallback, per-item focus_tags backshift/pronoun/time-adverb/question/command) + /grade (normalize→variant→LLM-judge→token-overlap fallback) + /recent + /stats with per-tag weakness; new reported_speech_attempts table+migration; ReportedSpeech page with TTS + focus-tag chip + textarea + inline diff highlights (missing/wrong/extra) + 5-item progress + per-tag accuracy bars + 'Practice weakest tag' CTA; Home CTA; 26 new tests; 2 pre-existing dashboard failures unrelated
708	146faa5	2026-04-21	69	1173	272	34	1548	2813	2815	pass	7.00	kept	Confusable Word Pair picker drill (affect/effect, borrow/lend, lay/lie, etc.): /api/confusable-pairs /start (LLM+12-pair fallback, 8 items) + /answer + /summary (per-pair accuracy + weakest) + new confusable_pair_sessions/attempts tables; ConfusablePairsPage with 2-chip picker, inline feedback, TTS of full sentence, weakest-pair retry; Home CTA; 17 new tests; 2 pre-existing dashboard failures unrelated
